CODE,DESCRIPTION,EXAMPLE
PersonalInfo_Education,"Mention of some part of their higher education (mentions of going to/currently being in college, bootcamp, high school, etc.). ","""I did really well in university. I had a really strong novelty preference and learning stuff gave me a huge rush."""
PersonalInfo_HasADHD_No,The person states/implies they do not have ADHD.,
PersonalInfo_HasADHD_Unsure,The person states/implies they are not sure if they have ADHD. (Or we are not sure that they have ADHD from the text),"""This has been my day-to-day life for the last twenty years or so - never even began to consider ADHD until my son started down the diagnosis path."""
PersonalInfo_HasADHD_Yes,"The person states/implies that they have ADHD, but do not also talk about their diagnosis (if it exists).","""I'm writing this on all those similar threads here, but have you tried pair programming? It works wonders for me and the other adhd person on my team."""
PersonalInfo_HasADHD_Yes_Diagnosed,The person was diagnosed by a medical professional with ADHD.,"""I was recently diagnosed with ADHD (would have helped if I was also medicated in school)"""
PersonalInfo_HasADHD_Yes_InDiagnosisProcess,The person is currently being diagnosed for ADHD by a medical professional.,"""I've suspected ADHD for a while now, but was only recently evaluated by a psychologist, who recommended trying medication."""
PersonalInfo_Location,"Any mention to where the person lives. This is not necessarily where they work, in the case of some remote jobs.","""we‘re located in Germany"""
PersonalInfo_Other,Any other personal information.,"""I’m a later in life career changer too"""
PersonalInfo_OtherDiagnoses,"The person is diagnosed with/has some other condition (e.g., dyslexia, narcolepsy, chronic pain). ","""I'm a 26yo female programmer with Dyspraxia, ADHD, and Ehlers Danlos Syndrome."""
PersonalInfo_SubstanceUse_NonUser,The person specifically says they do not use some or all substances for some reason.,"""I’m not medicated for my adhd and Dyspraxia"""
PersonalInfo_SubstanceUse_Prescribed,"A mention that person uses substances they were prescribed (e.g., prescription stimulants, SSRIs, etc.), but this usage is not tied to work or coping with work in any way.","""I am taking Concerta at 54mg for ADHD as of a few months ago."""
PersonalInfo_SubstanceUse_Recreational,"The person uses recreational substances, though not necessarily to cope with anything.","""I've found that many people with undiagnosed ADHD (myself maybe a year ago included) self- mesicate with Nicotine because it has a similar effect to Ritalin and the like. I used to smoke on my lunch break to ""clear up my mind""."
PersonalInfo_SubstanceUse_SideEffects,Some substance the person uses has negative side effects of some kind.,"""I stopped the Vyvanse because I realized I was
experiencing some side-effects. None of the horribly bad ones, but side effects none the less. My blood pressure had increased, but was managing with other meds."""
SoftwareWorkActivity,"Cannot be used alone in a quotation, or alone with OP. Includes subsequent quotes that refer to previous software activities mentioned. Also includes the actual content of interviews. If someone is “interviewing,” that should be tagged as WorkInfo because they are looking for a job. Should directly describe or mention the SoftwareWorkActivity, not just a coping mechanism about doing a SoftwareWorkActivity (so like, do not tag SWA this quote: “I gauge the email threads. If there's too much to discuss over email, I request a meeting to have it all laid out.”)",
SoftwareWorkActivity_CodeReview,"Looking over and reading code and verifying it for correctness, readability, etc.","""Doing deep work in the afternoons when I feel more booted-up (not a hard and fast rule though, if I
need to get into deep work mode all day, I do it, or if I have additional code review in the afternoon, I do
it)"""
SoftwareWorkActivity_Coding,Actually writing and generating new code in a programming language. ,"""It's too easy to add unneeded complexity because you think you're thinking 10 steps ahead, but by the time you get there you realise you made a bunch of assumptions that just don't hold up. Write the smallest simplest thing that works right now, and delay adding anything until you need it."""
SoftwareWorkActivity_Debugging,Fixing a problem in a program that has unintended output. ,"""Know that if you didn't have enough sleep, you will not be able to concentrate on fixing bugs. And learn to switch to another task that comes easy to you and doesn't need you to force yourself."""
SoftwareWorkActivity_Design,Designing how a program will work or look to a user.,"""The main reason I found that remote worked for me is that I can
take the initial steps I need to summarize requirements in a way I can understand"""
SoftwareWorkActivity_Documentation,"Reading or writing documentation about how a program works, how to use it, things that still must be fixed in it, etc.","""Shit documentation makes me actively depressed"""
SoftwareWorkActivity_Interview,"Any part of the interview process for a software job - it includes the technical aspect of the interview (e.g., coding test, etc.)","""I've been getting interviews for jobs but I cant seem to pass timed online assessments. I just never have enough time."""
SoftwareWorkActivity_Meetings,Meeting with coworkers to discuss work. Includes stand-up unless agile/scrum is explicitly mentioned.,"""I suggested shorter meetings, or having them split up."""
SoftwareWorkActivity_PairProgramming,"Doing any software work activity with another person at the same workstation, virtually or physically.","""Pair programming works great for me, especially if I'm the one sharing my screen because it forces me to be in the moment and think/code quicky so that I keep the other person engaged and don't waste their time.
But of course it's not always an option since other people have their own tasks to do; I can't just constantly ask other developers to be a rubber duck for me."""
SoftwareWorkActivity_Refactoring,Restructuring code while retaining its original functionality.,"""To make things worse: often I don‘t even have a good idea about how to refactor something. I mean, yes, I know that I could extract this and that, but then again I get lost in these details and miss
that this has an impact in other places."""
SoftwareWorkActivity_RequirementsElicitation,Speaking with a client or the recipient of a software product to understand what they want the product to be able to do functionally and what it should look like.,"""In the past I did get some feedback from my manager about going too far  into technical details when talking to non-technical stakeholders..."""
SoftwareWorkActivity_ScrumOrAgile,"Using Scrum or Agile processes in software development. Often called out by name, but also associated with words like ""sprints,"" ""stand-ups,"" etc. It is a framework of software development meant to incrementally, iteratively, and quickly make deadlines for working parts of a project.","""Agile/Jira (by managers who know how to  wield it, not bandwagoners) is actually great for ADHD, it gives you short turnarounds with discrete tasks."""
SoftwareWorkActivity_Testing,"Testing software to see if it has bugs in it (i.e., running a program to see if it behaves as expected).","""This is my strategy for not letting a 60 sec test suite take 20 minutes of productivity away."""
SoftwareWorkActivity_VersionControl,"When mentioning GitHub, pushing or pulling code, centralized repositiries etc. If the mention code review, don't do this tag - this is more of a catch all","""Github Actions is still slow."""
WorkEnvironment,"Any information that describes a job's environment. This can be describing a job that someone had in the past, in contrast to WorkInfo, which is only used for a job that someone currently has. ",
WorkEnvironment_OfficeType,"When talking about the configuration of an office at someone's work (open office, single cubicles, etc.). ","""Currently, I sit in a cubicle. Environmental noises
distract me."""
WorkEnvironment_WFH_HybridOrRemote,The job has some work remote.,"""I work from home though, so I've got it pretty easy admittedly."""
WorkEnvironment_WFH_InPerson,The job is fully in-person.,"""Personally I can't imagine going
back to working in an office, I was so fucking unproductive there, and a lot of it isn't even in your
control there... people are interrupting you all the time."""
WorkInfo,"Includes anything to do with their current (real, not hypothetical) work. This includes simple information about the poster’s job, whether they’re employed, whether or not they work from home, years of experience, etc. Does not include long paragraphs about how the company works or what kind of pull requests they work on. Does not need to be used when it is alone in a comment (unless that comment is made by the OP). Job location is included here.",
WorkInfo_Company_Industry,Content relating to the industry that a software development job is in.,"""I'm also in the software engineer world (embedded systems EE)"""
WorkInfo_Company_Size,"Content relating to how many people work at a company (e.g., ""FAANG,"" ""small start-up,"" etc.).","""I work for a small development firm."""
WorkInfo_Employed,"The person currently has a job, but it is unclear whether or not they are a professional programmer by what they're saying.","""My own small online business"""
WorkInfo_Fired,The person was fired.,"""I was fired from my first programming gig in November after about 18 months because I was not productive enough and made too many mistakes."""
WorkInfo_Internship,Content relating to an internship.,"""i might have an internship lined up and im scared of it"""
WorkInfo_Interviewing,The person was in the interviewing process.,"""trying to motivate myself to apply to other jobs and keep at it .. I only had 1 interview on Monday."""
WorkInfo_JobOffer,"The person has received a job offer for a job that they will work at in the near future, though they're not at the job yet.","""When I interviewed at my job I'm  starting after I graduate in May..."""
WorkInfo_JobSearch,The person is currently searching for another job.,"""I have like management barely but just staying happy is a struggle and makes everything else harder. Especially as my savings are slowly drained as I'm trying to find a job lol."""
WorkInfo_LaidOff,The person was laid off.,"""I got laid off work 2 months ago"""
WorkInfo_LeftOrResigned,The person is currently unemployed due to leaving/resigning from their most recent job.,"""Leaving Current Job After Four Years"""
WorkInfo_Location,"Where the person's job or clients are located, rather than where they live. This distinction can be necessary for remote jobs (see PersonalInfo_Location).","""...my company is in Eastern Time zone, our Primary client is west coast"""
WorkInfo_ProfessionalProgrammer,"The person is currently a professional programmer (i.e., their job heavily requires developing software).","""I'm a software engineer at a large bank for 3 years now"""
WorkInfo_Unemployed,"The person does not currently have a job and is not looking for a software-related job, and it is unclear what their most recent job was.","""2 months unemployed and depressed because of what you mentioned"""
WorkInfo_YOE,A mention of someone's years of professional experience in software development.,"""4.5 years of experience"""
Legality,When the law or company regulation is brought up as an influencing factor for something.,"""Practice your rights if you’re in the US & ask for workplace accomodations - how to adhd ok YouTube has a great video about the rules around this."""
SoftwareSpecific,"Whenever something of Adhd perceptions, work impacts, work environment, or any quote is software-specific, but not necessarily referring to a certain software task (e.g., mention of a programming tool). Don't use if it is also tagged with SoftwareWorkActivity","""Any JetBrains IDE + Fullscreen + Distraction-Free mode = godsend"""
InterestingQuote,"Whenever you subjectively find something interesting or find that something brings you a new insight, tag this so we can look at it later and maybe put it into the paper! InterestingQuote should also be used when leaving a quote at the top level, but you think that it will be useful for analysis or in the paper some way. ",